更新日,URL,タイトル,備考
2021/06/01,https://www.digital.go.jp/posts/p_9fVK2m,マイナポータルのデザインをリニューアル。児童手当現況届申請画面などが使いやすくなりました。,
2021/06/18,https://www.digital.go.jp/posts/ZlptjPro,「デジタル社会の実現に向けた重点計画」を閣議決定しました,
2021/07/01,https://www.digital.go.jp/posts/IKArEhyI,（受付終了）GIGAスクール構想について、教育に携わる皆様へアンケートのお願い,
2021/07/01,https://www.digital.go.jp/posts/APzucCWQ,（受付終了）タブレットについて、小中高校生へアンケートのおねがい&nbsp;,
2021/07/16,https://www.digital.go.jp/posts/qPLubLrj,令和3年度「こども霞が関見学デー」を開催しました,
2021/07/20,https://www.digital.go.jp/posts/A8kKSe7F,マイナンバーカード紹介動画を公開しました,
2021/07/20,https://www.digital.go.jp/posts/PKaVLvnv,（受付終了）GIGAスクール構想についてのアンケートを分析する事業者を募集します,
2021/07/30,https://www.digital.go.jp/posts/eNt9UVNC,引越しワンストップサービス（自治体手続） サービス検証等の参加自治体が決まりました&nbsp;,
2021/07/30,https://www.digital.go.jp/posts/UsZ6cDXd,ISMAPクラウドサービスリストを公開しました,
2021/08/04,https://www.digital.go.jp/posts/ThKAblNn,GIGAスクール構想についてのアンケートの分析事業者を決定しました,
2021/08/13,https://www.digital.go.jp/posts/1sZr0zP0,政府統一Webサイトに関する調達の入札説明会を行いました,
2021/08/20,https://www.digital.go.jp/posts/2ZYjJ7wg,デジタル庁発足に向けたコンプライアンス体制の確保について,
2021/08/20,https://www.digital.go.jp/posts/CM4Regng,「国民との共創による政策実現のためのコミュニティプラットフォーム実証事業」への参加事業者を募集します！&nbsp;,
2021/08/23,https://www.digital.go.jp/posts/KVRUL5Ih,2021年デジタル社会推進賞の募集を開始します！,
2021/08/23,https://www.digital.go.jp/posts/RigpA13o,引越しワンストップサービスの普及促進に向けた意見交換会への参加事業者が決まりました,
2021/08/27,https://www.digital.go.jp/posts/Bca6lKg9,コンプライアンス委員会の設置について,
2021/08/31,https://www.digital.go.jp/posts/TVSe2aRq,令和4年度予算概算要求・機構定員要求をとりまとめました,
2021/08/31,https://www.digital.go.jp/posts/7DD9AL91,「デジタル改革共創プラットフォーム（正式版）」のリニューアル予告-リニューアルに伴う正式版の一時サービス休止について-,
2021/09/01,https://www.digital.go.jp/posts/cqcCJziK,デジタル庁の設置に伴う各種規則及び告示の制定並びに整備にかかる意見募集の結果が公表されました,
2021/09/01,https://www.digital.go.jp/posts/uWAA9Dcp,デジタル庁発足式を行いました,
2021/09/01,https://www.digital.go.jp/posts/kMccIpBR,幹部等人事が決定しました,
2021/09/03,https://www.digital.go.jp/posts/NL3lOB9E,GIGAスクール構想についてのアンケートの取りまとめ結果を公表しました,
2021/09/13,https://www.digital.go.jp/posts/l9uhy2HU,ISMAPクラウドサービスリストを公開しました,
2021/09/15,https://www.digital.go.jp/posts/yS0M_VaX,デジタル・ガバメント推進標準ガイドラインを改定しました,
2021/09/16,https://www.digital.go.jp/posts/Bx1xWQBi,「2021年デジタルの日」に向けて、カウントダウン応援動画・楽曲が初解禁！,
2021/09/17,https://www.digital.go.jp/posts/ckWVVAya,（受付終了）コロナワクチンの接種証明書（電子交付）の仕様に関するご意見を募集します,
2021/09/24,https://www.digital.go.jp/posts/8pxOQG2O,懲戒処分の公表について,
2021/09/28,https://www.digital.go.jp/posts/J3M3x7at,地方自治体からデジタル庁職員を公募します,
2021/10/05,https://www.digital.go.jp/posts/b-SItqGk,10月10日（日）開催！「2021年デジタルの日」オンラインイベント詳細を発表しました,
2021/10/05,https://www.digital.go.jp/posts/4vlrFBy3,新しいデジタル庁アイデアボックスが始まります,
2021/10/06,https://www.digital.go.jp/posts/3XCS8cg4,デジタル大臣退任式・就任式を行いました,
2021/10/08,https://www.digital.go.jp/posts/OHfXf0Gp,民間事業者に対して公的個人認証サービスの利用に関する主務大臣認定を行いました,
2021/10/11,https://www.digital.go.jp/posts/g7b3GZuP,「2021年デジタルの日」オンラインイベントを開催しました,
2021/10/11,https://www.digital.go.jp/posts/KZ2w62RH,マイナンバーカードの健康保険証利用のデモイベントを実施しました,
2021/10/11,https://www.digital.go.jp/posts/6E_MCWFZ,「デジ道（仮）」文書制作のコンセプトを公表しました,
2021/10/11,https://www.digital.go.jp/posts/CFVm4laO,企業間の契約・決済について、全体像（見取り図）の設計に向けた検討を開始します,
2021/10/14,https://www.digital.go.jp/posts/6RFwVpXp,オープンデータ取組済自治体を更新しました,
2021/10/19,https://www.digital.go.jp/posts/LbGO0j4g,「コロナワクチンの接種証明書（電子交付）の仕様に関するご意見」の取りまとめ結果を公表しました,
2021/10/20,https://www.digital.go.jp/posts/lCQU-uoB,マイナンバーカードの健康保険証利用の本格運用がスタートしました,
2021/10/25,https://www.digital.go.jp/posts/tGZmsuPh,教育データ利活用についてのご意見を募集します,
2021/10/26,https://www.digital.go.jp/posts/7bIjgz40,（受付終了）データ戦略へのご意見をお寄せください,
2021/10/26,https://www.digital.go.jp/posts/ZYzU5DYY,ガバメントクラウド先行事業（市町村の基幹業務システム等）の採択結果を公表しました,
2021/10/26,https://www.digital.go.jp/posts/zytWmjcS,デジタル庁におけるガバメント・クラウド整備のためのクラウドサービスの提供－令和3年度地方公共団体による先行事業及びデジタル庁WEBサイト構築業務－の公募結果について,
2021/11/05,https://www.digital.go.jp/posts/fP9l2KD4,（受付終了）新重点計画の策定に向けてご意見を募集します,
2021/11/05,https://www.digital.go.jp/posts/ZiAUlNJC,公的給付の支給等の迅速かつ確実な実施のための預貯金口座の登録等に関する法律施行規則案に係る意見募集を行います,
2021/11/09,https://www.digital.go.jp/posts/_gctmaGw,電気通信回線を通じた送信又は電磁的記録媒体の送付の方法及び情報提供ネットワークシステムを使用した送信の方法に関する技術的基準の一部改正に係る意見募集を行います,
2021/11/09,https://www.digital.go.jp/posts/xpBE170a,行政手続における特定の個人を識別するための番号の利用等に関する法律に規定する個人番号、個人番号カード、特定個人情報の提供等に関する省令の一部改正に係る意見募集を行います,
2021/11/10,https://www.digital.go.jp/posts/4PB81KNy,自治体職員×政府機関職員「デジタル改革共創プラットフォーム」が始まります,
2021/11/18,https://www.digital.go.jp/posts/lCQU-uoB,マイナンバーカードの健康保険証利用の本格運用がスタートしました,
2021/11/25,https://www.digital.go.jp/posts/V7GLkItd,デンマーク王国とデジタル分野における協力覚書の署名式を行いました,
2021/11/26,https://www.digital.go.jp/posts/dSxBRA_c,水際対策強化に係る新たな措置（19）の電子申請（オンライン）のシステムリリース後の状況について,
2021/12/01,https://www.digital.go.jp/posts/M2NB81eg,モビリティに関する情報処理システムの連携の仕組み（アーキテクチャ）を描く検討を開始します,
2021/12/03,https://www.digital.go.jp/posts/5UyF41v6,データ戦略へのご意見をお寄せください（第2回）,
2021/12/07,https://www.digital.go.jp/posts/Ln4EAoqE,多様なステークホルダーで行政デジタル化をともに考える「Govtech Meetup」を開催します,
2021/12/20,https://www.digital.go.jp/posts/RqtKDNhJ,ISMAPクラウドサービスリストを公開しました,
2021/12/20,https://www.digital.go.jp/posts/caIzQeFN,民間事業者に対して公的個人認証サービスの利用に関する主務大臣認定を行いました,
2021/12/24,https://www.digital.go.jp/posts/d9Lvz21Y,公的給付の支給等の迅速かつ確実な実施のための預貯金口座の登録等に関する法律施行規則の意見公募の結果が公表されました,
2021/12/24,https://www.digital.go.jp/posts/79b7ZMv1,「デジタル社会の実現に向けた重点計画」が閣議決定されました,
2021/12/27,https://www.digital.go.jp/posts/iHtJvnVy,行政手続における特定の個人を識別するための番号の利用等に関する法律に規定する個人番号、個人番号カード、特定個人情報の提供等に関する省令の一部を改正する命令の意見公募の結果が公表されました,
2021/12/27,https://www.digital.go.jp/posts/pui4jA1O,電気通信回線を通じた送信又は電磁的記録媒体の送付の方法及び情報提供ネットワークシステムを使用した送信の方法に関する技術的基準の一部を改正する告示の意見公募の結果が公表されました,
2022/01/07,https://www.digital.go.jp/posts/a5F_DVWd,教育データ利活用ロードマップを策定しました,
2022/01/07,https://www.digital.go.jp/posts/9i9h33ff,多様なステークホルダーで行政デジタル化をともに考える「Govtech Meetup」（第2回）を開催します,
2022/01/11,https://www.digital.go.jp/posts/dbdnccO9,民間事業者に対して公的個人認証サービスの利用に関する主務大臣認定を行いました,
2022/01/13,https://www.digital.go.jp/posts/qcm0KZc-,オープンデータ取組済自治体を更新しました,
2022/01/18,https://www.digital.go.jp/posts/SdekP8ml,多様なステークホルダーで行政デジタル化をともに考える「Govtech Meetup」（第3回）を開催します,
2022/01/21,https://www.digital.go.jp/posts/H4KLVGtr,こどもに関する各種データの連携による支援実証事業の概要を発表しました,
2022/01/24,https://www.digital.go.jp/posts/snKVI9rx,新型コロナワクチン接種状況のダッシュボードとオープンデータをリニューアルしました,
2022/02/02,https://www.digital.go.jp/posts/vIQ4kN-Q,多様なステークホルダーで行政デジタル化をともに考える「Govtech Meetup」（第4回）を開催します,
2022/02/04,https://www.digital.go.jp/posts/LQNXkj8T,こどもに関する各種データの連携による支援実証事業（地方公共団体におけるデータ連携の実証に係る調査研究）の公募を開始します,
2022/02/04,https://www.digital.go.jp/posts/xp4mV1ce,民間事業者に対してマイナンバーカード（ICチップ）の空き領域の利用に関する告示を行いました,
2022/02/08,https://www.digital.go.jp/posts/NBqauWpN,「情報通信技術を利用する方法による国の歳入等の納付に関する法律案」が第208回国会（通常国会）に提出されました,
2022/02/10,https://www.digital.go.jp/posts/1A_v8lYr,第1回デジタル臨時行政調査会作業部会を開催 規制の横断的な点検・見直しを開始しました,
2022/02/16,https://www.digital.go.jp/posts/mWh4D8iz,多様なステークホルダーで行政デジタル化をともに考える「Govtech Meetup」（第5回）を開催します,
2022/02/17,https://www.digital.go.jp/posts/ZO16R_sA,デジタル臨時行政調査会作業部会 法制事務のデジタル化検討チーム第1回会合を開催しました,
2022/02/22,https://www.digital.go.jp/posts/vV3M2yLJ,第2回デジタル臨調作業部会を開催 官民連携し、アナログな規制を代替する先端技術を学びました,
2022/02/28,https://www.digital.go.jp/posts/H3kMGyNK,デジタル臨時行政調査会作業部会 法制事務のデジタル化検討チーム第2回会合を開催しました,
2022/03/03,https://www.digital.go.jp/posts/nDu6utZi,多様なステークホルダーで行政デジタル化をともに考える「Govtech Meetup」（第6回）を開催します,
2022/03/10,https://www.digital.go.jp/posts/wc04XJ5_,デジタル臨時行政調査会作業部会、関係省庁と見直しの議論を開始しました,
2022/03/15,https://www.digital.go.jp/posts/gvJ-J2GV,多様なステークホルダーで行政デジタル化をともに考える「Govtech Meetup」（第7回）を開催します,
2022/03/16,https://www.digital.go.jp/posts/Iuq7EUcu,デジタル臨時行政調査会作業部会 法制事務のデジタル化検討チーム第3回会合を開催しました,
2022/03/18,https://www.digital.go.jp/posts/c54jv0Ha,電気通信回線を通じた送信又は電磁的記録媒体の送付の方法及び情報提供ネットワークシステムを使用した送信の方法に関する技術的基準の一部改正に係る意見募集を行います,
2022/03/25,https://www.digital.go.jp/posts/VuHwzlAG,民間事業者に対して公的個人認証サービスの利用に関する主務大臣認定を行いました,
2022/03/29,https://www.digital.go.jp/policies/registration_information_system/,登記情報システムに係るプロジェクトの推進,
2022/03/29,https://www.digital.go.jp/posts/bj-XD6R2,ISMAPクラウドサービスリストを公開しました,
2022/03/30,https://www.digital.go.jp/councils/77bcb85a-52bb-4f82-b8d1-568b310b77a7/,デジタル臨時行政調査会（第3回）,
2022/03/30,https://www.digital.go.jp/policies/data_strategy_government_interoperability_framework/,政府相互運用性フレームワーク（GIF）,
2022/04/01,https://www.digital.go.jp/news/e840c89b-67f8-4199-8250-06c55d344101/,「デジタルを活用する未来に向けて」を制作しました,
2022/04/06,https://www.digital.go.jp/news/944c0d51-5e01-4e29-8360-2700ba51a882/,デジタル田園都市国家構想推進交付金（デジタル実装タイプTYPE2/3）の募集を開始しました,
2022/04/13,https://www.digital.go.jp/news/979a182e-faab-4d5e-b220-46d013779c4a/,デジタル臨時行政調査会作業部会 法制事務のデジタル化検討チーム第4回会合を開催しました,
2022/04/15,https://www.digital.go.jp/news/25069dcd-79a9-4358-af38-a25ae592c2e2/,「マイナンバーカードの機能のスマートフォン搭載等に関する検討会」 第2次とりまとめが公表されています,
2022/04/15,https://www.digital.go.jp/news/a1833f39-e7e9-47a5-bf31-848e29dde011/,「デジタル社会の実現に向けた重点計画」の改定に向けてご意見を募集します,
2022/04/19,https://www.digital.go.jp/news/07a0830c-02ab-456c-a4a4-8c95a4ec9e5c/,カシス・スイス連邦大統領兼外務大臣と意見交換を行いました,
2022/04/22,https://www.digital.go.jp/news/KgQ8ac8h/,ベース・レジストリのパイロット事業における実証サイトの公開を開始しました,
2022/04/27,https://www.digital.go.jp/news/e2c690f8-289a-45a4-8330-77297245945f/,デジタル推進委員に関する青年経済団体への先行的協力依頼を実施しました,
2022/05/04,https://www.digital.go.jp/news/c47ebac8-db98-4a50-a870-14f9993879d0/,日英デジタル・グループを立ち上げました,
2022/05/06,https://www.digital.go.jp/news/f24593e1-5fb6-4d4f-aeb8-243beb0a94ee/,スット・エストニア起業IT大臣とデジタル分野における協力覚書（MoC）の署名を行いました,
2022/05/09,https://www.digital.go.jp/news/6986eb8f-3e49-4239-9aee-4edf29869708/,電気通信回線を通じた送信又は電磁的記録媒体の送付の方法及び情報提供ネットワークシステムを使用した送信の方法に関する技術的基準の一部を改正する告示の意見公募の結果が公表されました,
2022/05/12,https://www.digital.go.jp/news/0b302f8b-dc10-45e2-964f-9f9cac2808db/,"牧島デジタル大臣がエストニア、フィンランド、ドイツへ出張しました
",
2022/05/12,https://www.digital.go.jp/news/b530adc8-3af1-4d9f-af84-6f21af4067af/,EUとのデジタルパートナーシップが立ち上げられました,
2022/05/12,https://www.digital.go.jp/news/a6d35d5d-c16b-4f09-a305-b5f6e9802552/,アドレス・ベース・レジストリの試験公開版についてご意見を募集します,
2022/05/12,https://www.digital.go.jp/news/KgQ8ac8h/,ベース・レジストリのパイロット事業における実証サイトの公開を開始しました,
2022/05/13,https://www.digital.go.jp/news/9ed33277-5315-4dcf-9551-d49d1acaaae1/,自治体職員向け説明動画「デジタル田園都市におけるWell-Being指標の活用について」を掲載しました,
2022/05/13,https://www.digital.go.jp/news/f1aa61e1-2bd0-4943-899d-2a490b059bf5/,デジタル臨時行政調査会作業部会 法制事務のデジタル化検討チーム第5回会合を開催しました,
2022/05/20,https://www.digital.go.jp/news/413cacb4-d766-4424-a87e-080f648fe572/,引越しワンストップサービス マイナポータルを通じた転出届・転入（転居）予約開始に向けた検討会及び検証等に協力いただける自治体を公募します,
2022/05/23,https://www.digital.go.jp/news/ZYzU5DYY/,ガバメントクラウド先行事業（市町村の基幹業務システム等）の採択結果を公表しました,
2022/05/25,https://www.digital.go.jp/news/95a68c6b-57d0-432e-9cd0-4eb48888618b/,情報通信技術を利用する方法による国の歳入等の納付に関する法律施行令案に係る意見募集を行います,
2022/05/26,https://www.digital.go.jp/news/KgQ8ac8h/,ベース・レジストリのパイロット事業における実証サイトの公開を開始しました,
2022/05/26,https://www.digital.go.jp/news/4ff18f06-2b4c-454e-b317-825326686e47/,IPA（独立行政法人情報処理推進機構）から企業間の契約・決済についてプロジェクト成果物の経過報告を受けました,
2022/05/26,https://www.digital.go.jp/news/ad6470b1-ef56-4381-9098-7069e16cf5f4/,シンガポール共和国・プットゥチェリーGovTech担当大臣とデジタル分野における協力覚書（MoC）の署名を行いました,
2022/05/27,https://www.digital.go.jp/news/ec432ea1-22ac-4d2c-8b13-5418598e5cf6/,「デジタルの日」賛同企業・団体の申請受付を開始しました,
2022/05/31,https://www.digital.go.jp/news/58a5c6cc-e113-4f7d-9ecc-18c8c030b28a/,デジタル推進委員の募集開始イベントを実施しました,
2022/06/01,https://www.digital.go.jp/news/6e2c0808-cb65-42ba-a002-7869f3293558/,行政手続における特定の個人を識別するための番号の利用等に関する法律別表第一の主務省令で定める事務を定める命令の一部を改正する命令案に係る意見募集を行います,
2022/06/01,https://www.digital.go.jp/news/69e96831-66b5-44b4-aaa9-394d32e5f204/,行政手続における特定の個人を識別するための番号の利用等に関する法律別表第二の主務省令で定める事務及び情報を定める命令の一部を改正する命令案に係る意見募集を行います,
2022/06/07,https://www.digital.go.jp/news/a1833f39-e7e9-47a5-bf31-848e29dde011/,「デジタル社会の実現に向けた重点計画」の改定に向けてご意見を募集します,
2022/06/07,https://www.digital.go.jp/news/92557bc3-a962-40bb-8d01-6dfd8d37c7c0/,「デジタル社会の実現に向けた重点計画」デジタル庁アイデアボックスにお寄せいただいたご意見について公表します,
2022/06/10,https://www.digital.go.jp/news/9efcc402-5a17-4f37-80bd-5f4fc8e41bcf/,引越しワンストップサービス マイナポータル「転出届・転入予約」機能のAPI仕様書（β版）等の情報提供を行います,
2022/06/15,https://www.digital.go.jp/news/2ce89a12-4082-45dc-a88f-32c0fe6a835a/,「ISMAP-LIUクラウドサービス登録規則（案）」等に対する意見募集を行います,
2022/06/15,https://www.digital.go.jp/news/9d248300-c021-4976-9f9a-d2d8682f1cba/,デジタル庁の偽サイトにご注意ください（注意喚起）,
2022/06/17,https://www.digital.go.jp/news/e91b13a9-fcee-4144-b90d-7d0a5c47c5f0/,こどもに関する各種データの連携による支援実証事業の実証事業計画書と実証事業ガイドラインを公表しました,
2022/06/20,https://www.digital.go.jp/news/c8b4052c-5ffc-4f93-bea4-4ea799f57154/,情報システム調達改革検討会を設置します,
2022/06/20,https://www.digital.go.jp/news/6edaefb0-6d39-4d7c-b2c9-792bd4457a13/,引越しワンストップサービス マイナポータルを通じた転出届・転入（転居）予約開始に向けた検討会及び検証等に協力いただく自治体が決まりました,
2022/06/20,https://www.digital.go.jp/news/c8b4052c-5ffc-4f93-bea4-4ea799f57154/,デジタル庁情報システム調達改革検討会を設置します,
2022/06/21,https://www.digital.go.jp/news/e5850ea6-215b-44ed-88cc-8dcf5c204919/,令和4年度「こども霞が関見学デー」の開催日をお知らせします,
2022/06/25,https://www.digital.go.jp/news/minister-220621-01/,会見::牧島大臣記者会見（令和4年6月21日）
2022/06/25,https://www.digital.go.jp/news/minister-220617-01/,会見::牧島大臣記者会見（令和4年6月17日）
2022/06/25,https://www.digital.go.jp/news/minister-220614-01/,会見::牧島大臣記者会見（令和4年6月14日）
2022/06/27,https://www.digital.go.jp/news/b0c1eadb-fb38-4581-885b-91b44088e01f/,報道発表::デジタル庁における新型コロナウイルス感染症の感染者の発生について（2022年6月27日）
2022/06/28,https://www.digital.go.jp/news/19eaa2af-d513-47d3-81aa-65b7e784479f/,政策::ウクライナ・フェドロフ副首相兼デジタル化担当大臣とオンラインで意見交換を行いました
2022/06/28,https://www.digital.go.jp/news/c9b382e1-391f-4635-9b12-e51d10eab6e7/,組織情報::令和4年6月28日付デジタル庁人事が決定しました
2022/06/28,https://www.digital.go.jp/news/1c842cba-2fdb-4e59-a49a-8e6b02a9441b/,政策::デジタルの日 「good digital award」募集受付を開始しました
2022/06/28,https://www.digital.go.jp/news/minister-220628-01/,会見::牧島大臣記者会見（令和4年6月28日）
2022/06/29,https://www.digital.go.jp/news/ed54cdd5-7a05-4858-a222-b72da7f0a8b2/,政策::ISMAPクラウドサービスリストを更新しました
2022/07/01,https://www.digital.go.jp/news/79163bd7-cf56-4d36-acbc-292c681cecbb/,組織情報::令和4年7月1日付デジタル庁人事が決定しました
2022/07/01,https://www.digital.go.jp/news/8f371426-ca9a-44ed-a31e-72f5da5a5056/,資料::オープンデータ取組済自治体を更新しました
2022/07/01,https://www.digital.go.jp/news/26c0d00b-6625-4e77-8b53-cebcba76a268/,政策::デジタル田園都市におけるWell-Being指標活用のためのβ版サイトが公開されました
2022/07/04,https://www.digital.go.jp/news/c4eaa5e2-cdc0-423e-869d-8ac744a1d700/,政策::「デジタルの日」オープニングムービーの募集受付を開始しました
2022/07/05,https://www.digital.go.jp/news/minister-220705-01/,会見::牧島大臣記者会見（令和4年7月5日）
2022/07/07,https://www.digital.go.jp/news/de98e4c2-6001-400c-8493-d92ec5ad7538/,報道発表::デジタル庁における新型コロナウイルス感染症の感染者の発生について（2022年7月7日）
